{
  "databases": [
    {
      "name": "schemas_testdb_tpl",
      "kind": "template",
      "detail": "0c4a0e652daabd0730d109c605041ad2f9fdf5f5a3b9b941d22489381094fe3e"
    },
    {
      "name": "schemas_testdb_clone1",
      "kind": "clone",
      "detail": "schemas_testdb_tpl"
    },
    {
      "name": "schemas_testdb_clone2",
      "kind": "clone",
      "detail": "schemas_testdb_tpl"
    }
  ],
  "ok": true,
  "command": "test-db list",
  "parser": {
    "pglast": "8.4",
    "pg_major": 18
  }
}
